{
  "site": "arxiv.org",
  "audited_at": "2026-09-05T10:27:02Z",
  "audit_scope": {
    "pages_sampled": 15,
    "sample_seed": 42,
    "sampled_urls": [
      "https://arxiv.org",
      "https://arxiv.org/list/stat.OT/recent",
      "https://arxiv.org/list/econ/new",
      "https://arxiv.org/archive/astro-ph",
      "https://arxiv.org/list/cs.MA/recent",
      "https://arxiv.org/list/cs.HC/recent",
      "https://arxiv.org/list/cond-mat.supr-con/recent",
      "https://arxiv.org/list/q-fin.PR/recent",
      "https://arxiv.org/list/astro-ph/recent",
      "https://arxiv.org/list/q-bio.GN/recent",
      "https://arxiv.org/list/q-fin.RM/recent",
      "https://arxiv.org/list/nlin.PS/recent",
      "https://arxiv.org/list/astro-ph.HE/recent",
      "https://arxiv.org/list/physics.atom-ph/recent",
      "https://arxiv.org/list/math.CT/recent"
    ],
    "robots_respected": true
  },
  "summary": {
    "total_findings": 1,
    "critical": 0,
    "high": 0,
    "medium": 1,
    "low": 0,
    "stage_scores": {
      "reachability": 100,
      "delivery": 100,
      "textuality": 100,
      "extractability": 84,
      "trust": 100,
      "engagement": 100
    },
    "headline": "Paper pages carry real, well-formed citation metadata (Highwire Press meta tags) but nothing in schema.org form -- machine-readable for citation tools, invisible to schema.org-only consumers \u2014 medium severity, Add a ScholarlyArticle JSON-LD block to paper pages, generated from the same values already populating the citation_* meta tags, without removing the existing tags."
  },
  "findings": [
    {
      "title": "Paper pages carry real, well-formed citation metadata (Highwire Press meta tags) but nothing in schema.org form -- machine-readable for citation tools, invisible to schema.org-only consumers",
      "stage": "extractability",
      "detected_by": "structured-data-audit",
      "evidence": "All 8 sampled /abs/<id> paper pages carry a complete, correctly-populated set of Highwire Press citation meta tags -- citation_title, citation_author (repeated per author), citation_date, citation_online_date, citation_pdf_url, citation_arxiv_id, citation_abstract -- a real, well-established machine-readable format that Google Scholar, Zotero, Mendeley and similar citation tools already consume. None of the 15 sampled pages (including these 8) contain any schema.org JSON-LD, microdata, or RDFa. This is a materially different, milder situation than a site with no machine-readable metadata at all: the facts are genuinely machine-extractable today, just via a citation-specific vocabulary rather than schema.org's ScholarlyArticle/Dataset types, which is what a general-purpose AI assistant extracting facts via schema.org specifically would look for.",
      "severity_inputs": {
        "stage": 4,
        "prevalence": "site-wide",
        "affected_fraction": 1.0,
        "criticality": "supporting"
      },
      "reproduction": {
        "urls": [
          "https://arxiv.org/abs/2609.00440"
        ],
        "command": "curl -s https://arxiv.org/abs/2609.00440 | grep -o 'name=\"citation_[a-z_]*\"' | sort -u; curl -s https://arxiv.org/abs/2609.00440 | grep -c 'application/ld+json'",
        "observed": "citation_* meta tags present (title, author x4, date, pdf_url, arxiv_id, abstract); 0 application/ld+json blocks",
        "expected": "A ScholarlyArticle JSON-LD block (headline, author, datePublished, identifier) alongside the existing citation_* tags, not instead of them"
      },
      "confidence": "high",
      "suggested_action": {
        "summary": "Add a ScholarlyArticle JSON-LD block to paper pages, generated from the same values already populating the citation_* meta tags, without removing the existing tags.",
        "priority": "medium",
        "mechanism": "The citation_* tags and schema.org serve different, non-overlapping consumer ecosystems -- academic citation tools versus general-purpose schema.org-consuming systems. Since every needed value (title, authors, date, arxiv id, abstract) already exists in the citation_* tags, emitting the same values a second time as ScholarlyArticle JSON-LD closes the schema.org gap without touching the existing, functioning citation metadata.",
        "steps": [
          "Add a ScholarlyArticle JSON-LD block per paper page with headline, author (name per author), datePublished, and identifier (the arXiv id), sourced from the same data already feeding the citation_* tags."
        ],
        "verification": "curl -s <any /abs/ URL> | grep -c '\"@type\":\"ScholarlyArticle\"' returns >= 1.",
        "effort": "moderate",
        "owner": "engineering"
      },
      "severity_score": 0.39,
      "severity": "medium",
      "id": "F-001"
    }
  ],
  "opportunities": [
    {
      "title": "Publish an llms.txt at the platform level pointing at how to query the API/OAI-PMH interface for bulk or structured access",
      "rationale": "arXiv already exposes a real bulk-metadata interface (referenced in its own robots.txt disallow list, e.g. /oai2), but a retrieval-capable assistant arriving via ordinary crawling has no way to discover that a better, structured access path exists for large-scale or precise queries.",
      "mechanism": "Pointing assistants at the proper API/metadata interface, rather than leaving them to scrape abstract pages one at a time, is both more efficient for arXiv's own infrastructure and more reliable for the assistant.",
      "priority": "low",
      "steps": [
        "Add an llms.txt at the site root naming the arXiv API and its documentation as the preferred bulk/structured access path."
      ],
      "effort": "trivial",
      "id": "O-001"
    }
  ],
  "not_assessed": [
    {
      "check": "Organization/platform identity (structured-data-audit) -- about/help pages",
      "reason": "This run's sample focused on category-listing and individual paper pages to properly exercise the research content pattern; arXiv's own /about or /help pages were not sampled.",
      "impact": "Cannot confirm whether the platform itself (as distinct from individual papers) carries Organization-level identity markup."
    },
    {
      "check": "Off-site corroboration (freshness-corroboration-audit, check 4)",
      "reason": "Not performed in this run to stay within the demonstration's time budget.",
      "impact": "Not applicable in the usual sense for this site type -- arXiv's own submissions are the primary source for most of its content -- but genuinely not checked."
    },
    {
      "check": "Question-coverage probe (answerability-audit, check 1) across arXiv's full breadth",
      "reason": "Only 4 of arXiv's roughly 150 subject categories were sampled (cs.HC, astro-ph, math.CT, q-fin.PR, q-bio.GN), chosen for topical diversity rather than exhaustive coverage.",
      "impact": "Findings should be read as representative of the shared page templates (which are identical across categories) rather than as claims about every subject area's specific content."
    }
  ]
}