{
  "site": "ar.wikipedia.org",
  "audited_at": "2026-09-07T19:36:30Z",
  "audit_scope": {},
  "summary": {
    "total_findings": 0,
    "critical": 0,
    "high": 0,
    "medium": 0,
    "low": 0,
    "stage_scores": {
      "reachability": 100,
      "delivery": 100,
      "textuality": 100,
      "extractability": 100,
      "trust": 100,
      "engagement": 100
    },
    "headline": "No findings detected in the audited sample."
  },
  "findings": [],
  "opportunities": [
    {
      "title": "No schema.org JSON-LD exists on sampled ar.wikipedia.org articles, for the same reason this is not flagged on ja.wikipedia.org or arxiv.org",
      "rationale": "Consistent with this project's ja.wikipedia.org report: a real, different, and independently maintained machine-readable channel (Wikidata) already serves the purpose on-page schema.org markup would, and is linked from every article. Flagging its absence the same way eff.org's genuine absence-of-any-channel was flagged would be a false positive.",
      "mechanism": "Not applicable -- recorded to explain a deliberate non-finding, consistent with this project's cross-site calibration discipline.",
      "priority": "low",
      "steps": [],
      "effort": "trivial",
      "id": "O-001"
    }
  ],
  "not_assessed": [
    {
      "check": "Answerability -- density/question-coverage classifiers (answerability-audit)",
      "reason": "declared_language is 'ar' (non-English); per this skill's documented exception, English-keyword density classifiers do not apply and were not run. No systematic question-coverage derivation was performed in the time available.",
      "impact": "Cannot state a coverage percentage; a scope limit of this run, not a claim about content quality, which reads as substantive (35,219 characters) on direct inspection."
    },
    {
      "check": "Right-to-left-specific text extraction edge cases -- bidirectional control characters, Arabic-Indic vs. Western numeral handling in date/phone regexes (freshness-corroboration-audit)",
      "reason": "Not systematically probed. This run confirmed the page fetches and decodes correctly (dir=\"rtl\", lang=\"ar\" both present and correct) and that overall text volume extracts sensibly, but did not specifically stress-test whether numeral or date regexes elsewhere in this project behave correctly against Arabic-Indic digits (\u00d9\u00a0-\u00d9\u00a9) if a sampled page used them instead of Western digits.",
      "impact": "A genuine, narrower gap than this run had time to close. Worth a follow-up run specifically sampling pages that mix numeral systems."
    },
    {
      "check": "Engagement and rendering-fidelity checks (engagement-audit, render-extractability-audit)",
      "reason": "This run hand-verified one article page, chosen specifically to confirm the non-ASCII URL fix (from the ja.wikipedia.org run) generalizes to a different script family and reading direction, rather than sampling broadly.",
      "impact": "The one page sampled delivered full, real text with no JavaScript dependency; a broader sample was not attempted."
    }
  ]
}